…………. Is the process of identifying and satisfying the needs of the customer.;Marketing;Sales;Distribution;Advertising;1
The payment mechanism typical to e-business;Credit and debit cards;Cash on delivery (cod);Cheques;E-cash;1
e-commerce does not include;A business’s interactions with its customers;Interactions among the various departments within the business;A business’s interactions with its suppliers;Interactions among the geographically dispersed units of the business;2
___transactions have business firms at one end and its customers on the other end.;C2b commerce;B2c commerce;B2b commerce;C2c commerce;2
India is the preferred destination for BPO because of ____________.;Tax free zone for bpos;Cheap people;Cheap manpower;Poor conditions;3
Out of e-commerce and e-business, which is a broader term?;E-commerce;E-business;E-trade;E-control;2
A Call Centre handles;Both customer facing and back-end business;Both voice based and non-voice based business;Only out-bound voice based business;Only in bound voice based business;1
Outsourcing;Includes off shoring;Restricts only to the contracting out of information technology enabled services (ites) ;Restricts only to the contracting out of non-core business processes;Includes contracting out of manufacturing and r&d as well as service processes both core and noncore but restricts only to domestic territory;1
_____________ is not a process tools for TQM systems.;Process flow analysis;Histograms;Plier;Control charts;3
The process mapping is a ______ diagram. ;Data flow;Work flow;Circular;Audit;2
Total Quality Management (TQM) focuses on;Employee;Tax organization;Exchange rate;Inflation;1
Which of the following is responsible for quality objective?;Top level management;Middle level management;Frontline management;Low level of management ;1
The following is (are) the machine down time.;No material;Labor hour;Electricity;Gas;1
EU requires labelling requirement in _______ language/s. ;One;Two;Three;Four;4
EU needs ________ packaging requirements.;Eco-friendly;Thermoformed;Laminated;Corrugated;1
______is the best illustration of a subculture.;Occupation;Income;Religion;Family & friends;3
______ are the form of human needs take as shaped by culture & individual personality.;Wants;Demands;Needs;Social needs;3
A place where goods are bought and sold against the price consideration between the buyers and the sellers is called ______.;Exchange;Market;E-commerce;Transaction;2
_______ Involves transfer of ownership of the goods.;Selling;Assembling;Buying;Ssembling & buying;1
________ is not a type of Marketing Concept.;The production concept;The selling concept;The societal marketing concept;The supplier concept;4
Marketing management is ________.;Developing marketing strategies to move the company forward;Managing the marketing process;Monitoring the profitability of the company’s products and services;The art and science of choosing target markets and getting, keeping, and growing customers through creating, delivering, and communicating superior customer value;4
When customer expectations regarding product quality, service quality, and value-based price are met or exceeded, _____ is created.;Customer satisfaction;Planning excellence;A quality rift;A value line;1
